{
  "$schema": "../schemas/control-plane-recovery-matrix.schema.json",
  "schema_id": "mdplace.control-plane-recovery-matrix/v1",
  "matrix_id": "RECOVERY-CP-001",
  "version": "1.0.0",
  "semantic_authority": "none",
  "rows": [
    {
      "case_id": "RC-CP-001",
      "interruption_point": "before_enqueue_commit",
      "actor_authority": {
        "roles": [
          "mdplace_agent"
        ],
        "quorum": 1,
        "distinct_actors": false,
        "delegation": "forbidden"
      },
      "durable_observations": [
        "absence of EnqueueReceipt for the idempotency key",
        "exact Work Journal head sequence and digest"
      ],
      "preconditions": [
        "current retained writer receipt binds the persistent Agent and exact next epoch"
      ],
      "base_references": [
        "idempotency key and input digest",
        "exact Work Journal head"
      ],
      "emitted_records": [
        "WorkRecoveryDenied"
      ],
      "filesystem_effects": [
        "none unless an exact Vault Mutation Gate recovery contract separately authorizes reconciliation"
      ],
      "idempotency": "The same recovery identity and exact observations return the original receipt.",
      "terminal_result": "deny with unchanged semantic truth",
      "failure_result": "control.recovery_precondition_failed; state unchanged",
      "recovery": "Deny acceptance because no durable Work Item exists; an exact future enqueue may create version one.",
      "default_decision": "deny"
    },
    {
      "case_id": "RC-CP-002",
      "interruption_point": "after_enqueue_commit",
      "actor_authority": {
        "roles": [
          "mdplace_agent"
        ],
        "quorum": 1,
        "distinct_actors": false,
        "delegation": "forbidden"
      },
      "durable_observations": [
        "authenticated EnqueueReceipt",
        "exact committed Work Item version and input digest"
      ],
      "preconditions": [
        "enqueue receipt sequence is at or below the exact Work Journal head"
      ],
      "base_references": [
        "exact Work Journal head",
        "exact Work Item identity, version, idempotency key, and input digest"
      ],
      "emitted_records": [
        "WorkRecoveryReceipt"
      ],
      "filesystem_effects": [
        "none unless an exact Vault Mutation Gate recovery contract separately authorizes reconciliation"
      ],
      "idempotency": "The same recovery identity and exact observations return the original receipt.",
      "terminal_result": "resume with unchanged semantic truth",
      "failure_result": "control.recovery_precondition_failed; state unchanged",
      "recovery": "Preserve the single queued Work Item and return the original EnqueueReceipt.",
      "default_decision": "resume"
    },
    {
      "case_id": "RC-CP-003",
      "interruption_point": "after_lease_receipt_before_ack",
      "actor_authority": {
        "roles": [
          "mdplace_agent"
        ],
        "quorum": 1,
        "distinct_actors": false,
        "delegation": "forbidden"
      },
      "durable_observations": [
        "authenticated WorkLeaseReceipt",
        "lease owner, version, acquired tick, expiry tick, and status"
      ],
      "preconditions": [
        "lease remains active and its duration is at most 300 ticks"
      ],
      "base_references": [
        "exact Work Journal head",
        "exact Work Item version",
        "exact active Work Lease"
      ],
      "emitted_records": [
        "WorkRecoveryReceipt"
      ],
      "filesystem_effects": [
        "none unless an exact Vault Mutation Gate recovery contract separately authorizes reconciliation"
      ],
      "idempotency": "The same recovery identity and exact observations return the original receipt.",
      "terminal_result": "preserve with unchanged semantic truth",
      "failure_result": "control.recovery_precondition_failed; state unchanged",
      "recovery": "Preserve the single lease and return its receipt; do not create a second owner.",
      "default_decision": "preserve"
    },
    {
      "case_id": "RC-CP-004",
      "interruption_point": "after_dequeue_ack_before_execution",
      "actor_authority": {
        "roles": [
          "mdplace_agent"
        ],
        "quorum": 1,
        "distinct_actors": false,
        "delegation": "forbidden"
      },
      "durable_observations": [
        "WorkLeaseReceipt",
        "durable expiry or revocation observation"
      ],
      "preconditions": [
        "lease identity and work version match",
        "lease is expired at the recovery tick or explicitly revoked"
      ],
      "base_references": [
        "exact Work Journal head",
        "exact Work Item version",
        "exact expired or revoked Work Lease"
      ],
      "emitted_records": [
        "WorkRecoveryReceipt"
      ],
      "filesystem_effects": [
        "none unless an exact Vault Mutation Gate recovery contract separately authorizes reconciliation"
      ],
      "idempotency": "The same recovery identity and exact observations return the original receipt.",
      "terminal_result": "requeue with unchanged semantic truth",
      "failure_result": "control.recovery_precondition_failed; state unchanged",
      "recovery": "Append one WorkRecoveryReceipt and requeue without acknowledging a second owner.",
      "default_decision": "requeue"
    },
    {
      "case_id": "RC-CP-005",
      "interruption_point": "during_execution_without_completion_receipt",
      "actor_authority": {
        "roles": [
          "mdplace_agent"
        ],
        "quorum": 1,
        "distinct_actors": false,
        "delegation": "forbidden"
      },
      "durable_observations": [
        "absence of authenticated completion receipt",
        "exact retry and recovery interruption counts"
      ],
      "preconditions": [
        "lease is expired or revoked",
        "next recovery interruption count equals current count plus one and is at most two"
      ],
      "base_references": [
        "exact Work Journal head",
        "exact executing Work Item version",
        "exact Work Lease",
        "versioned semantic dependency digests"
      ],
      "emitted_records": [
        "WorkRecoveryReceipt"
      ],
      "filesystem_effects": [
        "none unless an exact Vault Mutation Gate recovery contract separately authorizes reconciliation"
      ],
      "idempotency": "The same recovery identity and exact observations return the original receipt.",
      "terminal_result": "requeue with unchanged semantic truth",
      "failure_result": "control.recovery_precondition_failed; state unchanged",
      "recovery": "Consume one recovery interruption and one retry, record an eligibility tick, and never claim completion.",
      "default_decision": "requeue"
    },
    {
      "case_id": "RC-CP-006",
      "interruption_point": "after_completion_receipt_before_terminal_record",
      "actor_authority": {
        "roles": [
          "mdplace_agent"
        ],
        "quorum": 1,
        "distinct_actors": false,
        "delegation": "forbidden"
      },
      "durable_observations": [
        "authenticated CompletionReceipt",
        "bound output digest and signer identity"
      ],
      "preconditions": [
        "receipt signature binds exact work, version, lease, journal sequence, outcome, output, and persistent Agent"
      ],
      "base_references": [
        "exact Work Journal head",
        "exact Work Item version and Work Lease",
        "authenticated completion receipt"
      ],
      "emitted_records": [
        "WorkRecoveryReceipt"
      ],
      "filesystem_effects": [
        "none unless an exact Vault Mutation Gate recovery contract separately authorizes reconciliation"
      ],
      "idempotency": "The same recovery identity and exact observations return the original receipt.",
      "terminal_result": "preserve with unchanged semantic truth",
      "failure_result": "control.recovery_precondition_failed; state unchanged",
      "recovery": "Finalize and preserve the authenticated result without repeating child or parent work.",
      "default_decision": "preserve"
    },
    {
      "case_id": "RC-CP-007",
      "interruption_point": "after_cancellation_receipt_before_child_stop",
      "actor_authority": {
        "roles": [
          "mdplace_agent"
        ],
        "quorum": 1,
        "distinct_actors": false,
        "delegation": "forbidden"
      },
      "durable_observations": [
        "CancellationReceipt",
        "active Child Work Invocation identity when present"
      ],
      "preconditions": [
        "cancellation binds the exact Work Item version"
      ],
      "base_references": [
        "exact Work Journal head",
        "exact Work Item and cancellation versions",
        "current child capability receipt"
      ],
      "emitted_records": [
        "WorkRecoveryReceipt"
      ],
      "filesystem_effects": [
        "none unless an exact Vault Mutation Gate recovery contract separately authorizes reconciliation"
      ],
      "idempotency": "The same recovery identity and exact observations return the original receipt.",
      "terminal_result": "preserve with unchanged semantic truth",
      "failure_result": "control.recovery_precondition_failed; state unchanged",
      "recovery": "Preserve cancellation and revoke the exact child capability without accepting child output.",
      "default_decision": "preserve"
    },
    {
      "case_id": "RC-CP-008",
      "interruption_point": "restart_with_cancelled_work",
      "actor_authority": {
        "roles": [
          "mdplace_agent"
        ],
        "quorum": 1,
        "distinct_actors": false,
        "delegation": "forbidden"
      },
      "durable_observations": [
        "CancellationReceipt",
        "durable resume count and ceiling"
      ],
      "preconditions": [
        "new retained writer receipt is current",
        "all seven Readiness Gates pass in order"